uuid,article_url,article
1741709129-790,https://www.detailingwiki.org/tag/uv-radiation/,Articles related to correction
1741708867-656,https://www.detailingwiki.org/tag/vonixx/,Manufacturers of Detailing related products
1741709124-789,https://www.detailingwiki.org/tag/vacco/,"Detail King is an American manufacturer and supplier of automotive detailing products. The company offers products, trainings, classes, and authorizes detailers to use their products."
1741708715-582,https://www.detailingwiki.org/tag/washing-car/,Washing a car in the summer gives the risk of the sun evaporating the water quicker then it can be dried off. You either have to be quick or smart to prevent waterspots or dried up products. These tips might help you in reducing the risk.
1741709046-740,https://www.detailingwiki.org/tag/valeting-videos/,Miscellaneous detailing related content
1741710796-1365,https://www.detailingwiki.org/tag/swirls/,Marring is a superficial surface imperfection most commonly seen after claying. It is slightly similar to a combination between swirls and holograms.
1741708417-392,https://www.detailingwiki.org/tag/weekly-wash/,"The snowfoam lance is an attachment for a pressure washer that pushes water and a soap micture through a nozzle with a very fine filter in it. This makes the soap mixture foam as soon as it leaves the nozzle. The foam is sprayed over the surface you want to clean. In turn, the foam will soak the dirt, making it easier to rinse off the dirt before washing."
1741709769-1049,https://www.detailingwiki.org/tag/touchless-wash/,"A touchless wash is type of cleaning method that cleans via chemical cleaning, and doesn’t require any mechanical action. This method is popular for those we are afraid that contact with the surface might cause abrasive marks. Whether touchless washing gives the same results is still a popular topic for debate."
1741708581-507,https://www.detailingwiki.org/tag/water-spritz/,"Keeping your pad clean is very important, because the paint residue on/in your pad can cause scouring onto the paint surface. If the pad has become clogged, we can’t get a perfect finish."
1741707998-165,https://www.detailingwiki.org/tag/wiper/,Articles related to decontamination
1741707685-14,https://www.detailingwiki.org/tag/youtube/,Junkman2000 is the channel of enthusiast detailer: A.J. Johnson. The Youtube channel with 164 videos has a steady stream of followers ever since it beginning in 2006 with 34.992 subscribers. Junkman2000 has a rough viewing audience of 4.648.607 views.
1741709374-903,https://www.detailingwiki.org/tag/turtlewax/,Manufacturers of Detailing related products
1741710706-1316,https://www.detailingwiki.org/tag/t-a-c-t/,"Cleaning a surface is not always easy. The product itself needs to be able to remove the product, but there should also be a safe method to remove the soap-dirt mixture. The cleaning pie gives insight in the factors that play a role in cleaning."
1741710700-1314,https://www.detailingwiki.org/tag/t1/,Wax is a protective product that is used to protect a surface from outside contaminants. It is made up out of several ingredients with wax as the main ingredient.
1741708586-513,https://www.detailingwiki.org/tag/water-sprite/,"S.M. Arnold Inc. is an American manufacturer of detailing products that is the backbone of extra brands such as Water Sprite, Speedy surface prep, Speedy Stik and Speedy Super Foamer. The company originates from 1928 and has a wide variety of detailing products."
1741709076-765,https://www.detailingwiki.org/tag/valeting/,"Conservation is a large part in the detailing process. It prevent wear and tear and is aimed at maintaining the original properties of the object. Conservation can also be financially rewarding, as is the case with most oldtimers or supercars."
1741708729-586,https://www.detailingwiki.org/tag/washing-bike/,"The one bucket method is the most used method of washing a car, but is also the least recommended way of washing the car. In this method the user only uses 1 bucket, which doesn’t allow for much rinsing of the sponge/washmitt."
1741710568-1241,https://www.detailingwiki.org/tag/temperature/,"When glass has a temperature that is lower then, or equal to 0 degrees Celsius, any water coming in contact with it, will freeze and turn into ice. This is often seen in cold climates or seasons and might require the ice to be removed."
1741707850-104,https://www.detailingwiki.org/tag/wool/,"Overall pad performance is dependent on the type and amount of fabric, stiffness and length of the fibers and how they are attached to the pad. The difference between a foam pad, different kind of wool pads and a microfiber pad are discussed in relation to the Kevin Brown Method."
1741711044-1529,https://www.detailingwiki.org/tag/strong/,Miscellaneous detailing related content
1741710515-1215,https://www.detailingwiki.org/tag/testing/,"A testspot is a small area where you try out different combinations of polish, polishing pads and even machines or techniques, to see what works best with the given situation."
1741710609-1270,https://www.detailingwiki.org/tag/tar/,"Cleaning up the wheel and arch at the start of a detail can make a big difference to the end result. Even as part of a general wash, ensuring the wheel arches are fully cleaned out is important to ensure that the car doesn’t have a clean bodywork but then muddy covered arches which stand out a mile away!"
1741710472-1200,https://www.detailingwiki.org/tag/texas/,"Autosol is an American manufacturer of detailing products for various vehicles. A large portion focusses on automotive detailing products, but they also cater for industrial processes, marine, metal, motorcycles and home cleaning. The company is based in Austin, Texas and was founded in 2003."
1741710732-1332,https://www.detailingwiki.org/tag/synthetic/,Microfibers are a fabric that is designed to have certain characteristics. The microscopic fibers of this synthetic fabric can be made to have certain properties by design. Making them excel at certain tasks.
1741709776-1051,https://www.detailingwiki.org/tag/touchless/,"A touchless wash is type of cleaning method that cleans via chemical cleaning, and doesn’t require any mechanical action. This method is popular for those we are afraid that contact with the surface might cause abrasive marks. Whether touchless washing gives the same results is still a popular topic for debate."
1741710085-1133,https://www.detailingwiki.org/tag/tips/,Guides to detailing
1741708815-640,https://www.detailingwiki.org/tag/warm/,Guides to detailing
1741708469-431,https://www.detailingwiki.org/tag/waxed/,Waxedshine is an United Kingdom based manufacturer of detailing products. The brand has a wide variety of products on offer via their own webshop. The English company is run by father and son.
1741711049-1536,https://www.detailingwiki.org/tag/stroke/,According to Kevin Brown there are different kind of ways to prime your pad. For defect removal we use a different approach in priming the pad than for final polishing.
1741710972-1499,https://www.detailingwiki.org/tag/summit/,Manufacturers of Detailing related products
1741707760-47,https://www.detailingwiki.org/tag/wrap/,"Paint protection film is a more extreme form of protecting the paintwork of your vehicle. Unlike chemical protectants, a PPF can protect against stone chips, small objects and even some very chemical liquids."
1741707699-18,https://www.detailingwiki.org/tag/yarquenxer/,Miscellaneous detailing related content
1741708526-457,https://www.detailingwiki.org/tag/wax-by-hand/,"Rubbing polish is the act of using ones hand or skin to apply the polish to the surface by hand, and creating a moving effect in order to get a polishing effect on the surface underneath. The method can be compared to applying wax by hand."
1741710807-1381,https://www.detailingwiki.org/tag/swirl/,"One method of getting rid of swirl marks is to basically fill up the mark with a filler (a bit like anti-wrinkle cream!!) so that there’s no longer a hole and sharp edges to catch the light. This method I prefer for working by hand as it does not require massive effort to break a product down, and by hand this method achieves better results."
1741709919-1096,https://www.detailingwiki.org/tag/tony-dowsett/,Manufacturers of Detailing related products
1741709076-762,https://www.detailingwiki.org/tag/valeting/,"Green Auto Clean inc. is a Canadian distributor and reseller that carries its own product, including brands such as Nanoskin, Tornador, Flex, Sonax, SM Arnlod,Inter Steam and several others. The company isn’t very active outside of their own website."
1741709137-793,https://www.detailingwiki.org/tag/uv-damage/,"Paintwork can, in some cases, become oxidized. Making it turn matte and slightly fade color. If untreated, it can eventually cause the lacquer and/or paintwork to completely fail. It is most common on red cars, but it can happen with every color."
1741707903-128,https://www.detailingwiki.org/tag/wolfs-chemicals/,Manufacturers of Detailing related products
1741709675-995,https://www.detailingwiki.org/tag/training/,"Palm Beach Motoring Group, or PBMG, is the largest car care manufacturer, reseller and distributor in America. The company is owned by Vision Investments LLC. and is located in Florida, USA."
1741708532-461,https://www.detailingwiki.org/tag/wax/,Stjärnagloss is a United Kingdom located manufacturer of detailing related products since early 2010. The brand started selling via Shinearama but after a quiet period relaunched the brand in 2019 with new products. The products with Scandinavian names might give a clue on the roots of the brand.
1741708883-664,https://www.detailingwiki.org/tag/vision/,"Frost or ice on your windscreen can affect your ability to properly see your surroundings. Removing ice or frost from glass will increase not only your own safety, but also that of others. It can also be illegal to drive without proper visibility."
1741707846-91,https://www.detailingwiki.org/tag/wool-pad/,"A random orbital and its different settings can affect your performance in a great way. A couple of big issues that influence the polishing performance are the speed, stroke size and pressure. But first some general information about the machine."
1741708965-707,https://www.detailingwiki.org/tag/vehicle-cover/,"A car cover is a product that can be used to cover a car, possibly protecting it against the elements. It is often used when a vehicle isn’t used for a certain amount of time and needs to look dust- and dirtless."
1741709529-948,https://www.detailingwiki.org/tag/truck-bed-protection/,Miscellaneous detailing related content
1741709249-855,https://www.detailingwiki.org/tag/underbody/,"Underbody cleaning is the act of cleaning the underside of the car to remove any dirt and restore the looks as when the car was new. This is a tedious and labor intensive job, but good cleaning products and tools can help to make it easier."
1741709197-838,https://www.detailingwiki.org/tag/united-kingdom/,"Smart Polish Pro is an English manufacturer of detailing products with a strong aim on environmental-friendly products that do not require the use of water. The company is fairly young, but has been growing in popularity in only a few years."
1741710297-1172,https://www.detailingwiki.org/tag/thickness/,"A Paint Thickness Gauge (often abbreviated to PTG, and also called a Paint Depth Gauge) is an electronic device that measures the distance between the body-panel and the sensor. This way you can measure the thickness of the paint. This gives you an indication of how much paint you have left to work with."
1741708090-217,https://www.detailingwiki.org/tag/william-bailey/,"Duragloss is an American manufacturer of automotive, marine and racing detailing related products. The has been in the detailing business since 1973 and was formed by two brothers. Duragloss is based in Burlington, North Caroline."
1741709488-937,https://www.detailingwiki.org/tag/tuf-shine/,Tuf Shine is an American company that creates detailing products. They are probably best known for making the only tire sealant in the world. The company was set up by Ron West and Bob Curtis.
1741708532-463,https://www.detailingwiki.org/tag/wax/,"Leanofy is the company behind Neowax, which is a manufacturer of detailing products, located in Germany. The company aims mostly of protective products and offers both wax, sealants and coatings as part of their range."
1741708265-347,https://www.detailingwiki.org/tag/wetordry/,"3M is one of the largest manufacturers in the world in many different fields. 3M is known to be the owner of brands such as Scotchgard, Mguiars and many more. The company also makes many different products under their own brand."
1741710002-1114,https://www.detailingwiki.org/tag/tires/,"An all purpose cleaner (often abbreviated into: APC) is a multipurpose, liquid, spray-on cleaner that can be used on several types of dirt. It is one of the most common products used by a detailer due to its versatility."
1741709291-874,https://www.detailingwiki.org/tag/uk/,"ValetPro is an English manufacturer of detailing related products. Although the brand offers a very wide range of products, their cleaners are likely to be the most popular products among most detailers."
1741707760-54,https://www.detailingwiki.org/tag/wrap/,"Paint can be repaired in several different ways. Some of these paint repair techniques can be done by most people, others should only be done by professional painters. The method needed to fix the paint depends on the severity of the paint imperfection. Some forms of repair are most expensive then others."
1741708537-469,https://www.detailingwiki.org/tag/waterspots/,Miscellaneous detailing related content
1741710710-1317,https://www.detailingwiki.org/tag/t-rex/,Miscellaneous detailing related content
1741709507-942,https://www.detailingwiki.org/tag/truck-wash/,Wash related content
1741710915-1460,https://www.detailingwiki.org/tag/surface/,"Paintwork can, in some cases, become oxidized. Making it turn matte and slightly fade color. If untreated, it can eventually cause the lacquer and/or paintwork to completely fail. It is most common on red cars, but it can happen with every color."
1741709981-1109,https://www.detailingwiki.org/tag/tom/,"Leanofy is the company behind Neowax, which is a manufacturer of detailing products, located in Germany. The company aims mostly of protective products and offers both wax, sealants and coatings as part of their range."
1741708648-553,https://www.detailingwiki.org/tag/washmitt/,"When you ask a detailer for a starter pack, they will often begin with 2 buckets and a proper washmitt. But why? What’s so special about a washmitt that you need to have it? A washmitt is essential in taken care of your vehicle in a way that will minimize the amount of surface imperfections you create."
1741709919-1097,https://www.detailingwiki.org/tag/tony-dowsett/,"RestorFX originates from 2006 and was founded by Alexander and Nadia Kay and Tony Dowsett. The company is located in Vancouver, British Columbia, Canada. It is one of only a few Canadian manufacturers of automotive detailing products."
1741708548-476,https://www.detailingwiki.org/tag/waterless-washing/,"A rinseless wash is a washing technique that allows you to wash your car in a way that does not require rinsing afterwards. It is not waterless, but rinseless. This way of washing can save on time and/or product and prevents too much chemicals from going down the drain."
1741709578-961,https://www.detailingwiki.org/tag/trims/,Wash related content
1741709391-909,https://www.detailingwiki.org/tag/turpentine/,Guides to detailing
1741707894-122,https://www.detailingwiki.org/tag/wolfgang-determan/,Miscellaneous detailing related content
1741709179-820,https://www.detailingwiki.org/tag/unpainted-trim/,Miscellaneous detailing related content
1741708648-551,https://www.detailingwiki.org/tag/washmitt/,"Road spray is a dirty mist of contaminants in the air, thrown up by a vehicle driving over the road. Road spray is partly the cause for traffic film and can cause dirt and grime, even when the weather has been dry and there is no obvious origin for dirt on a vehicle."
1741710878-1431,https://www.detailingwiki.org/tag/surface-imperfection/,"Removing a scratch is a very important part of the correction process. However, there are several different ways of removing several different types of scratches. It also needs an explanation on what removing a scratch actually means."
1741708273-348,https://www.detailingwiki.org/tag/wetlook/,Miscellaneous detailing related content
1741710002-1113,https://www.detailingwiki.org/tag/tires/,"Paintwork gets cleaned very frequently, but tyres not so much. Everybody who knows the word “detailer” or “valeter” probably knows how to safely remove contaminants from the surface of a vehicle. Even when glass is dirty, you’ll quickly see the streaks and your fingers will be itching to reach for the glass cleaner. Most parts of a vehicles gets cleaned frequently, and we have all kinds of products that help us keep our cars/bikes looking sparkly clean."
1741708500-445,https://www.detailingwiki.org/tag/wax-over-sealant/,"In the field of protection, there are generally 4 groups of products: wax, sealant, hybrid and coatings. These products can be combined, but with mixed results. Knowing what the properties of a product are will clarify the end result."
1741708715-580,https://www.detailingwiki.org/tag/washing-car/,Salt is an unwelcome type of contamination on your vehicle. Salt can cause rapid corrosion and extreme dage to unprotected metals. It can also severely stain polished metals and create a matte look over the surface.
1741708953-700,https://www.detailingwiki.org/tag/velour/,Miscellaneous detailing related content
1741708737-592,https://www.detailingwiki.org/tag/washing/,"Monstershine Car Care is an Scottisch manufacturer of detailing product. The brand was founded by John and Stephen and currently is located in Glasgow, Scotland. The company has been active since 2014."
1741707813-77,https://www.detailingwiki.org/tag/world/,"Poorboys World is a manufacturer of detailing products that range from polish to shampoos and cleaners. The product are being sold worldwide and focusses on the quality of their products, nothing else. Not even their labels."
1741708623-526,https://www.detailingwiki.org/tag/water-behavior/,Miscellaneous detailing related content
1741707726-30,https://www.detailingwiki.org/tag/written-articles/,"DetailingWiki is a non-profit collection of writers and editors who aim to spread their knowledge and insight of the world of detailing. These articles are written by several different detailers and are added to the database. The main inspiration of the concept came from WikiPedia, the largest online encyclopedia in the world."
1741709274-863,https://www.detailingwiki.org/tag/ultimate/,Meguiars is an American manufacturer and seller of detailing products. They sell a wide variety of products and have different product ranges to cater for several different levels of experience.
1741708633-539,https://www.detailingwiki.org/tag/water/,"When glass has a temperature that is lower then, or equal to 0 degrees Celsius, any water coming in contact with it, will freeze and turn into ice. This is often seen in cold climates or seasons and might require the ice to be removed."
1741709727-1022,https://www.detailingwiki.org/tag/trade/,"Professional Valeters and Detailers is a trade association in the United Kingdom, that offers a large directory of accredited detailers in their network. By vetting each detailer/valeter in their network they are able to offer a very wide range of skilled and proven detailers in almost all areas."
1741708055-204,https://www.detailingwiki.org/tag/window/,"Glass can just as easily chip as paintwork can. Unfortunately, repairing chipped glass is a bit more difficult then repairing chipped paint. Chipped glass repair requires skill, tools, experience and patience. It is often done by trained people for best result."
1741707990-162,https://www.detailingwiki.org/tag/wiper-jump/,Wiper judder refers to “jumping” wipers that shake/jump/judder when moving over the windscreen. The rubber from the windscreen wiper sticks to the glass surface even though the wiper arm continues to move. The rubber “jumps” over the surface instead of gliding smoothly over the glass.
1741709744-1032,https://www.detailingwiki.org/tag/towels/,"Polish Angel is a German manufacturer and seller of detailing related products. The brand sells shampoo, polish, protective products, but also polish pads, gloves and MF towels. Polish Angel is being sold around the world, but it only has distribution places in and around Germany and America."
1741709155-804,https://www.detailingwiki.org/tag/use/,"Leather itself has to withstand a lot of abuse over the years. Jeans rubbing over it, dirty clothes, UV, high temperatures, low temperatures, dry air, humid air, liquids, chemicals etc. To keep the leather looking fresh and prevent it from drying out, a leather protection can be used."
1741708788-630,https://www.detailingwiki.org/tag/warner-chemical/,"Warner Chemical Manufacturing is the company behind a few internationally available brands of detailing products. The company operates from California, America."
1741708343-371,https://www.detailingwiki.org/tag/wet-and-dry/,Miscellaneous detailing related content
1741707813-76,https://www.detailingwiki.org/tag/world/,"Detailing World is one of the biggest online community’s in the world of detailing. The forum is based vBulletin and holds many thousands of members. Many detailing manufacturers, webshops and distributors are found here."
1741710700-1312,https://www.detailingwiki.org/tag/t1/,Manufacturers of Detailing related products
1741708801-637,https://www.detailingwiki.org/tag/warm-vs-cold/,"Some prefer to wash with warm water, others prefer to wash with cold water. Although the experience of working with it may be different, it is not completely clear what the difference is in the effect it has on a product or a surface."
1741708311-360,https://www.detailingwiki.org/tag/wet-vac/,"There are 2 general ways for deep cleaning fabric. Using a vacuum cleaner (just removing surface dirt), or using a wet/dry vacuum cleaner (deep clean the fabric). When you deep clean fabric, you need to take into account that you will spent a lot more time on it."
1741708961-705,https://www.detailingwiki.org/tag/vehicles/,"Carlack is a Swiss manufacturer of car care products that has been making products since 1958. The brand is divided into 4 sections: Carlack, Aerolack, Yachtlack and Polylack, to cater for the need of several different type of surfaces and types of contaminants."
1741709887-1077,https://www.detailingwiki.org/tag/tools/,Manufacturers of Detailing related products
1741709076-759,https://www.detailingwiki.org/tag/valeting/,"Work Stuff is one of a few Polish manufacturers of detailing equipment. The brand originates from Poland and has ditributors and reseller accross Europe. The company focusses mostly towards equipment, accessories and towel. The brand is often recognized because of their destincive yellow color."
1741707998-167,https://www.detailingwiki.org/tag/wiper/,"Wiper marks are surface imperfections in the direction and line that windscreen wipers move. Simply put, these are marks in the glass caused by the movement of the windscreen wipers. They can affect your vision and are difficult te remove."
1741707850-100,https://www.detailingwiki.org/tag/wool/,"For removing defects with the Kevin Brown Method we first apply a massive amount of the finishing polish on the pad and massage it in. This is to prime your pad properly, so that the product covers the hole face of the pad."
1741709675-993,https://www.detailingwiki.org/tag/training/,Manufacturers of Detailing related products
1741710647-1291,https://www.detailingwiki.org/tag/tacsystem/,Manufacturers of Detailing related products
1741710326-1175,https://www.detailingwiki.org/tag/the-netherlands/,Manufacturers of Detailing related products
1741709056-746,https://www.detailingwiki.org/tag/valeting-products/,AMMO NYC is a detailing products manufacturer with the slogan “Drive + Protect”. The brand offers a small range of products aimed at the most common steps in the detailing process.
1741709474-933,https://www.detailingwiki.org/tag/tuffer-buffer/,"S.M. Arnold Inc. is an American manufacturer of detailing products that is the backbone of extra brands such as Water Sprite, Speedy surface prep, Speedy Stik and Speedy Super Foamer. The company originates from 1928 and has a wide variety of detailing products."
1741708050-197,https://www.detailingwiki.org/tag/windows/,"Glass can just as easily chip as paintwork can. Unfortunately, repairing chipped glass is a bit more difficult then repairing chipped paint. Chipped glass repair requires skill, tools, experience and patience. It is often done by trained people for best result."
1741708663-562,https://www.detailingwiki.org/tag/washing-tyres/,Articles related to decontamination
1741708516-453,https://www.detailingwiki.org/tag/wax-gone/,The removal of wax is a necessary step before a protective product is (re-)applied or before polishing. Wax is a hard type of protective product that is made from a large portion of natural ingredients. It has a limited lifespan and needs to be removed after a certain period.
1741710891-1442,https://www.detailingwiki.org/tag/surface-damage/,Bird poo can be a big problem with paintwork and needs to be removed as soon as possible. Bird droppings have several aggressive chemicals in them that can severely damage paintwork. Not removing these can cause paint defects that might not be removable. In some cases a respray is needed to repair the surface.
